Inconnu;37 items=37 ; HLESGE00-FAS09-018 HLESXF00-ECS03-017 HLESGE00-FAS09-017 HLESAD01-FAS09-137-UNI HLESXF00-ECS03-017 HLESXF00-ECS03-050 OBAGC534-ECS03-485 HLESXF00-ECS03-540 HLESAD01-FAS31-086 HLESXF00-ECS03-055 HLESAD01-FAS09-379 OBAGS001-TESS2-018 HLESGE00-FAS09-086 HLESCE01-ECS00-055 HLESCE01-ECS00-055 HLESCE01-ECS00-055 HLESCE01-ECS00-055 HLESCE01-ECS00-055 HLESCE01-ECS00-055 HLESCE01-ECS00-055 HLESCE01-ECS00-055 HLESCE01-ECS00-055 OBAGB001-EVS00-018 OBAGC534-TESP2-241 OBAGS002-TESS2-485 HLESGE00-FAS09-050 HLESXF00-ECS03-050 HLESXF00-ECS03-055 OBAGC534-ECS03-018 OBAGC534-ECS03-540 OCLKS007-SIS01-013-L HLESAD01-FAS09-018 OBAGT002-LAS15-009 HLESXF00-ECS03-540 OBAGS001-TESS2-485 OBAGP506-ECS92-227 HLESAD01-FAS09-055;page inconnue
fall 2018 presentation/catalogo fall 2018.txt;43 items=1 9 2 1 1 1 2 1 1 1 5 2 6 1 1 6 1 1 ; OBAGB002-EVS00-076 OBAGB034-EVS00-485 OBAGB034-EVS00-017 OBAGB034-EVS00-018 OBAGB034-EVS00-371 OBAGB034-EVS00-050 OBAGB034-EVS00-055 OBAGB034-EVS00-076 OBAGB034-EVS00-071 OBAGB034-EVS00-541 OBAGB024-EVS00-002 OBAGB024-EVS00-050 SHOUGB00-TESP2-549 OBAGT001-FAS09-008 OBAGT001-LAS04-008 OBAGT002-FAS09-008 OBAGT002-FAS09-009 OBAGT032-FAS02-548 OBAGS001-TES81-550 OBAGS002-TES81-550 OBAGS034-FAS09-541 OBAGS034-FAS09-008 OBAGS034-FAS09-055 OBAGS034-FAS09-018 OBAGS034-TES73-227 OBAGS034-TESQ8-549 OBAGS034-TESR8-545 OBAGS034-TESR1-055 OBAGS034-TESR1-076 OBAGS034-TESR1-017 OBAGS034-TESR1-086 OBAGS034-TESR1-018 OBAGS034-TESR1-258 OBAGP006-FAS09-006 OBAGP506-ECS91-553 OBAGP034-ECS29-055 OBAGP034-ECS29-540 OBAGP034-ECS29-018 OBAGP034-ECS29-084 OBAGP034-ECS29-017 OBAGP034-ECS29-108 OBAGC534-TESP1-227 OBAGC534-ECS84-227;6,13,15,35,44,49,55,66,79,82,100,101,102,106,109,112,116,117
fall 2019 presentation_/catalogo fall 19.txt;11 items=1 5 1 1 2 1 ; OBAGB002-EVS00-076 OBAGB034-EVS00-017 OBAGB034-EVS00-055 OBAGB034-EVS00-071 OBAGB034-EVS00-076 OBAGB034-EVS00-371 OBAGT001-FAS09-008 OBAGT001-LAS04-008 OBAGT002-FAS09-008 OBAGT002-FAS09-009 OBAGP006-FAS09-006;8,13,53,60,67,112
spring 2018 presentation/catalogo spring 2018 continuativo.txt;5 items=2 1 2 ; OBAGT001-FAS09-008 OBAGT001-FAS09-008 OBAGT001-LAS04-008 OBAGT002-FAS09-008 OBAGT002-FAS09-008;26,28,29
spring 2018 presentation/catalogo spring 2018.txt;1 item=1 ; OBAGB002-EVS00-076;6
spring 2019 presentation/catalogo Spring 19.txt;3 items=3 ; OBAGB034-EVS00-017 OBAGB034-EVS00-055 OBAGB034-EVS00-371;13
summer 2018 presentation/catalogo summer 2018 continuativo.txt;5 items=2 1 2 ; OBAGT001-FAS09-008 OBAGT001-FAS09-008 OBAGT001-LAS04-008 OBAGT002-FAS09-008 OBAGT002-FAS09-008;32,34,35
summer 2018 presentation/catalogo summer 2018.txt;1 item=1 ; OBAGB002-EVS00-076;5
summer 2019 presentation/catalogo summer_beach 2019.txt;4 items=4 ; OBAGB034-EVS00-017 OBAGB034-EVS00-055 OBAGB034-EVS00-071 OBAGB034-EVS00-371;20
winter 2018 presentation/catalogo winter 18.txt;20 items=1 8 1 2 1 1 1 1 3 1 ; OBAGB002-EVS00-076 OBAGB034-EVS00-485 OBAGB034-EVS00-017 OBAGB034-EVS00-018 OBAGB034-EVS00-371 OBAGB034-EVS00-050 OBAGB034-EVS00-055 OBAGB034-EVS00-071 OBAGB034-EVS00-541 OBAGB034-EVS00-076 OBAGB024-EVS00-002 OBAGB024-EVS00-050 OBAGT001-FAS09-008 OBAGT001-LAS04-008 OBAGT002-FAS09-008 OBAGT032-FAS02-548 OBAGS034-FAS09-008 OBAGS034-FAS09-018 OBAGS034-FAS09-055 OBAGP006-FAS09-006;6,18,19,22,46,52,56,65,99,102
