'019;075;OBAGAM16-MAS00-026;-;-;ACCESSOIRE ANSES O MOON EN PLASTIQUE;UNICA
'020;049;OBAGAM16-MAS00-422;-;-;ACCESSOIRE ANSES O MOON EN PLASTIQUE;UNICA
'021;013;OBAGAM16-MAS00-486;-;-;ACCESSOIRE ANSES O MOON EN PLASTIQUE;UNICA
'075;035;OBAGS601-TESY3-026;spring 2019 presentation/catalogo Spring 19.txt;p056-1-01;POCHETTE INTERIEURE SWITCH O BAG EN TISSU IMPRIME FLOWER CAMOUFLAGE;UNICA
'078;092;OBAGS602-TESY3-026;spring 2019 presentation/catalogo Spring 19.txt;p062-1-01;POCHETTE INTERIEURE SWITCH O BAG MINI EN TISSU IMPRIME FLOWER CAMOUFLAGE;UNICA
'079;006;OBAGS616-TESY3-026;spring 2019 presentation/catalogo Spring 19.txt;p066-1-01;POCHETTE INTERIEURE SWITCH O MOON EN TISSU IMPRIME FLOWER CAMOUFLAGE;UNICA
